Cites,Authors,Title,Year,Source,Publisher,ArticleURL,CitesURL,GSRank,QueryDate,Type,DOI,ISSN,CitationURL,Volume,Issue,StartPage,EndPage,ECC,CitesPerYear,CitesPerAuthor,AuthorCount,Age,Abstract,FullTextURL,RelatedURL
362,"J. Schweitzer, B. Song, T. Herrington, T. Park, Nayeon Lee, Sanghyeok Ko, J. Jeon, Young-gon Cha, Kyungsang Kim, Quanzheng Li, C. Henchcliffe, M. Kaplitt, Carolyn Neff, O. Rapalino, Hyemyung Seo, In‐Hee Lee, Jisun Kim, Taewoo Kim, G. Petsko, J. Ritz, B. Cohen, S. Kong, P. Leblanc, B. Carter, Kwang-Soo Kim",Personalized iPSC-Derived Dopamine Progenitor Cells for Parkinson's Disease.,2020,The New England journal of medicine,,https://www.semanticscholar.org/paper/a69444bc119b1acc1e825c1e9faa83e84138c776,,128,2026-01-21 21:46:31,JournalArticle,10.1056/NEJMoa1915872,0028-4793,,382.0,20.0,1926.0,1932.0,362,60.33,36,25,6,"We report the implantation of patient-derived midbrain dopaminergic progenitor cells, differentiated in vitro from autologous induced pluripotent stem cells (iPSCs), in a patient with idiopathic Parkinson's disease. The patient-specific progenitor cells were produced under Good Manufacturing Practice conditions and characterized as having the phenotypic properties of substantia nigra pars compacta neurons; testing in a humanized mouse model (involving peripheral-blood mononuclear cells) indicated an absence of immunogenicity to these cells. The cells were implanted into the putamen (left hemisphere followed by right hemisphere, 6 months apart) of a patient with Parkinson's disease, without the need for immunosuppression. Positron-emission tomography with the use of fluorine-18-L-dihydroxyphenylalanine suggested graft survival. Clinical measures of symptoms of Parkinson's disease after surgery stabilized or improved at 18 to 24 months after implantation. (Funded by the National Institutes of Health and others.).",https://www.nejm.org/doi/pdf/10.1056/NEJMoa1915872?articleTools=true,
240,"Chenglong Xie, Xu-Xu Zhuang, Zhangming Niu, Rui-ting Ai, Sofie Lautrup, Shuangjia Zheng, Yinghui Jiang, Ruiyu Han, Tanima Sen Gupta, Shuqin Cao, M. J. Lagartos-Donate, Cui-Zan Cai, Liwei Xie, D. Caponio, Wen-wen Wang, Tomas Schmauck-Medina, Jianying Zhang, He-Ling Wang, Guofeng Lou, Xianglu Xiao, Wenhua Zheng, K. Palikaras, Guang Yang, Kim A. Caldwell, G. Caldwell, Hanyuan Shen, H. Nilsen, Jiahua Lu, E. Fang",Amelioration of Alzheimer’s disease pathology by mitophagy inducers identified via machine learning and a cross-species workflow,2022,Nature Biomedical Engineering,,https://www.semanticscholar.org/paper/1d9cb39dc0493d509f5a6ddbdcd7e2ca0b6613ca,,223,2026-01-21 21:46:31,JournalArticle,10.1038/s41551-021-00819-5,2157-846X,,6.0,,76.0,93.0,240,60.0,24,29,4,"A reduced removal of dysfunctional mitochondria is common to aging and age-related neurodegenerative pathologies such as Alzheimer’s disease (AD). Strategies for treating such impaired mitophagy would benefit from the identification of mitophagy modulators. Here we report the combined use of unsupervised machine learning (involving vector representations of molecular structures, pharmacophore fingerprinting and conformer fingerprinting) and a cross-species approach for the screening and experimental validation of new mitophagy-inducing compounds. From a library of naturally occurring compounds, the workflow allowed us to identify 18 small molecules, and among them two potent mitophagy inducers (Kaempferol and Rhapontigenin). In nematode and rodent models of AD, we show that both mitophagy inducers increased the survival and functionality of glutamatergic and cholinergic neurons, abrogated amyloid-β and tau pathologies, and improved the animals’ memory. Our findings suggest the existence of a conserved mechanism of memory loss across the AD models, this mechanism being mediated by defective mitophagy. The computational–experimental screening and validation workflow might help uncover potent mitophagy modulators that stimulate neuronal health and brain homeostasis. Two potent mitophagy inducers, identified and characterized via unsupervised machine learning and a cross-species screening approach, ameliorated the pathology of Alzheimer’s disease in worms and mice.",https://www.nature.com/articles/s41551-021-00819-5.pdf,
757,"Guo Zhang, Juxue Li, S. Purkayastha, Yizhe Tang, Hai Zhang, Ye Yin, Bo Li, Gang Liu, D. Cai",Hypothalamic Programming of Systemic Aging Involving IKKβ/NF-κB and GnRH,2013,Nature,,https://www.semanticscholar.org/paper/76f587028b3fe045ee0b88a741d3197c014f5c98,,37,2026-01-21 21:46:31,JournalArticle,10.1038/nature12143,0028-0836,,497.0,,211.0,216.0,757,58.23,84,9,13,"Ageing is a result of gradual and overall functional deteriorations across the body; however, it is unknown whether an individual tissue primarily works to mediate the ageing progress and control lifespan. Here we show that the hypothalamus is important for the development of whole-body ageing in mice, and that the underlying basis involves hypothalamic immunity mediated by IκB kinase-β (IKK-β), nuclear factor κB (NF-κB) and related microglia–neuron immune crosstalk. Several interventional models were developed showing that ageing retardation and lifespan extension are achieved in mice by preventing ageing-related hypothalamic or brain IKK-β and NF-κB activation. Mechanistic studies further revealed that IKK-β and NF-κB inhibit gonadotropin-releasing hormone (GnRH) to mediate ageing-related hypothalamic GnRH decline, and GnRH treatment amends ageing-impaired neurogenesis and decelerates ageing. In conclusion, the hypothalamus has a programmatic role in ageing development via immune–neuroendocrine integration, and immune inhibition or GnRH restoration in the hypothalamus/brain represent two potential strategies for optimizing lifespan and combating ageing-related health problems.",https://www.ncbi.nlm.nih.gov/pmc/articles/PMC3756938,
285,"Marlene Schmidt, Z. Gan, D. Komander, G. Dewson",Ubiquitin signalling in neurodegeneration: mechanisms and therapeutic opportunities,2021,Cell Death & Differentiation,,https://www.semanticscholar.org/paper/b6c6c867fa844dbe707c285cd82004e89fa0ac1a,,175,2026-01-21 21:46:31,Review,10.1038/s41418-020-00706-7,1350-9047,,28.0,,570.0,590.0,285,57.0,71,4,5,"Neurodegenerative diseases are characterised by progressive damage to the nervous system including the selective loss of vulnerable populations of neurons leading to motor symptoms and cognitive decline. Despite millions of people being affected worldwide, there are still no drugs that block the neurodegenerative process to stop or slow disease progression. Neuronal death in these diseases is often linked to the misfolded proteins that aggregate within the brain (proteinopathies) as a result of disease-related gene mutations or abnormal protein homoeostasis. There are two major degradation pathways to rid a cell of unwanted or misfolded proteins to prevent their accumulation and to maintain the health of a cell: the ubiquitin–proteasome system and the autophagy–lysosomal pathway. Both of these degradative pathways depend on the modification of targets with ubiquitin. Aging is the primary risk factor of most neurodegenerative diseases including Alzheimer’s disease, Parkinson’s disease and amyotrophic lateral sclerosis. With aging there is a general reduction in proteasomal degradation and autophagy, and a consequent increase of potentially neurotoxic protein aggregates of β-amyloid, tau, α-synuclein, SOD1 and TDP-43. An often over-looked yet major component of these aggregates is ubiquitin, implicating these protein aggregates as either an adaptive response to toxic misfolded proteins or as evidence of dysregulated ubiquitin-mediated degradation driving toxic aggregation. In addition, non-degradative ubiquitin signalling is critical for homoeostatic mechanisms fundamental for neuronal function and survival, including mitochondrial homoeostasis, receptor trafficking and DNA damage responses, whilst also playing a role in inflammatory processes. This review will discuss the current understanding of the role of ubiquitin-dependent processes in the progressive loss of neurons and the emergence of ubiquitin signalling as a target for the development of much needed new drugs to treat neurodegenerative disease.",https://www.nature.com/articles/s41418-020-00706-7.pdf,
386,"G. Cenini, A. Lloret, R. Cascella",Oxidative Stress in Neurodegenerative Diseases: From a Mitochondrial Point of View,2019,Oxidative Medicine and Cellular Longevity,,https://www.semanticscholar.org/paper/ed5fe00715c4e4839249c27c51d1862517672a45,,113,2026-01-21 21:46:31,Review,10.1155/2019/2105607,1942-0994,,2019.0,,,,386,55.14,129,3,7,"Age is the main risk factor for a number of human diseases, including neurodegenerative disorders such as Alzheimer's disease, Parkinson's disease, and amyotrophic lateral sclerosis, which increasing numbers of elderly individuals suffer. These pathological conditions are characterized by progressive loss of neuron cells, compromised motor or cognitive functions, and accumulation of abnormally aggregated proteins. Mitochondrial dysfunction is one of the main features of the aging process, particularly in organs requiring a high-energy source such as the heart, muscles, brain, or liver. Neurons rely almost exclusively on the mitochondria, which produce the energy required for most of the cellular processes, including synaptic plasticity and neurotransmitter synthesis. The brain is particularly vulnerable to oxidative stress and damage, because of its high oxygen consumption, low antioxidant defenses, and high content of polyunsaturated fats very prone to be oxidized. Thus, it is not surprising the importance of protecting systems, including antioxidant defenses, to maintain neuronal integrity and survival. Here, we review the role of mitochondrial oxidative stress in the aging process, with a specific focus on neurodegenerative diseases. Understanding the molecular mechanisms involving mitochondria and oxidative stress in the aging and neurodegeneration may help to identify new strategies for improving the health and extending lifespan.",http://downloads.hindawi.com/journals/omcl/2019/2105607.pdf,
264,"C. Alquézar, S. Arya, A. Kao","Tau Post-translational Modifications: Dynamic Transformers of Tau Function, Degradation, and Aggregation",2021,Frontiers in Neurology,,https://www.semanticscholar.org/paper/86b3e608b24a2acf3715d6a57ac78b3ce54d2536,,198,2026-01-21 21:46:31,Review,10.3389/fneur.2020.595532,1664-2295,,11.0,,,,264,52.8,88,3,5,"Post-translational modifications (PTMs) on tau have long been recognized as affecting protein function and contributing to neurodegeneration. The explosion of information on potential and observed PTMs on tau provides an opportunity to better understand these modifications in the context of tau homeostasis, which becomes perturbed with aging and disease. Prevailing views regard tau as a protein that undergoes abnormal phosphorylation prior to its accumulation into the toxic aggregates implicated in Alzheimer's disease (AD) and other tauopathies. However, the phosphorylation of tau may, in fact, represent part of the normal but interrupted function and catabolism of the protein. In addition to phosphorylation, tau undergoes another forms of post-translational modification including (but not limited to), acetylation, ubiquitination, glycation, glycosylation, SUMOylation, methylation, oxidation, and nitration. A holistic appreciation of how these PTMs regulate tau during health and are potentially hijacked in disease remains elusive. Recent studies have reinforced the idea that PTMs play a critical role in tau localization, protein-protein interactions, maintenance of levels, and modifying aggregate structure. These studies also provide tantalizing clues into the possibility that neurons actively choose how tau is post-translationally modified, in potentially competitive and combinatorial ways, to achieve broad, cellular programs commensurate with the distinctive environmental conditions found during development, aging, stress, and disease. Here, we review tau PTMs and describe what is currently known about their functional impacts. In addition, we classify these PTMs from the perspectives of protein localization, electrostatics, and stability, which all contribute to normal tau function and homeostasis. Finally, we assess the potential impact of tau PTMs on tau solubility and aggregation. Tau occupies an undoubtedly important position in the biology of neurodegenerative diseases. This review aims to provide an integrated perspective of how post-translational modifications actively, purposefully, and dynamically remodel tau function, clearance, and aggregation. In doing so, we hope to enable a more comprehensive understanding of tau PTMs that will positively impact future studies.",https://www.frontiersin.org/articles/10.3389/fneur.2020.595532/pdf,
315,"Tim Bartels, Sebastiaan De Schepper, Soyon Hong",Microglia modulate neurodegeneration in Alzheimer’s and Parkinson’s diseases,2020,Science,,https://www.semanticscholar.org/paper/7faaa27e7ae8924c0b44b2e686c649e6c15d03a6,,159,2026-01-21 21:46:31,Review,10.1126/science.abb8587,0193-4511,,370.0,,66.0,69.0,315,52.5,105,3,6,"Dementia is a rapidly rising global health crisis that silently disables families and ends lives and livelihoods around the world. To date, however, no early biomarkers or effective therapies exist. It is now clear that brain microglia are more than mere bystanders or amyloid phagocytes; they can act as governors of neuronal function and homeostasis in the adult brain. Here, we highlight the fundamental role of microglia as tissue-resident macrophages in neuronal health. Then, we suggest how chronic impairment in microglia-neuron cross-talk may secure the permanence of the failure of synaptic and neuronal function and health in Alzheimer’s and Parkinson’s diseases. Understanding how to assess and modulate microglia-neuron interactions critical for brain health will be key to developing effective therapies for dementia.",https://discovery.ucl.ac.uk/10113826/1/Hong_abb8587%20copy.pdf,
101,"L. Honig, M. Sabbagh, C. V. van Dyck, R. Sperling, S. Hersch, Andre Matta, Luigi Giorgi, M. Gee, M. Kanekiyo, David Li, Derk Purcell, S. Dhadda, M. Irizarry, L. Kramer",Updated safety results from phase 3 lecanemab study in early Alzheimer’s disease,2024,Alzheimer's Research & Therapy,,https://www.semanticscholar.org/paper/cd51aa7985d78d1b08fe02aba3fc7ea5aafb8034,,736,2026-01-21 21:46:31,ClinicalTrial,10.1186/s13195-024-01441-8,1758-9193,,16.0,,,,101,50.5,10,14,2,"Background Alzheimer disease (AD) is a major health problem of aging, with tremendous burden on healthcare systems, patients, and families globally. Lecanemab, an FDA-approved amyloid beta (Aβ)-directed antibody indicated for the treatment of early AD, binds with high affinity to soluble Aβ protofibrils, which have been shown to be more toxic to neurons than monomers or insoluble fibrils. Lecanemab has been shown to be well tolerated in multiple clinical trials, although risks include an increased rate of amyloid-related imaging abnormalities (ARIA) and infusion reactions relative to placebo. Methods Clarity AD was an 18-month treatment (Core study), multicenter, double-blind, placebo-controlled, parallel-group study with open-label extension (OLE) in participants with early AD. Eligible participants were randomized 1:1 across 2 treatment groups (placebo and lecanemab 10 mg/kg biweekly). Safety evaluations included monitoring of vital signs, physical examinations, adverse events, clinical laboratory parameters, and 12-lead electrocardiograms. ARIA occurrence was monitored throughout the study by magnetic resonance imaging, read both locally and centrally. Results Overall, 1795 participants from Core and 1612 participants with at least one dose of lecanemab (Core + OLE) were included. Lecanemab was generally well-tolerated in Clarity AD, with no deaths related to lecanemab in the Core study. There were 9 deaths during the OLE, with 4 deemed possibly related to study treatment. Of the 24 deaths in Core + OLE, 3 were due to intracerebral hemorrhage (ICH): 1 placebo in the Core due to ICH, and 2 lecanemab in OLE with concurrent ICH (1 on tissue plasminogen activator and 1 on anticoagulant therapy). In the Core + OLE, the most common adverse events in the lecanemab group (> 10%) were infusion-related reactions (24.5%), ARIA with hemosiderin deposits (ARIA-H) microhemorrhages (16.0%), COVID-19 (14.7%), ARIA with edema (ARIA-E; 13.6%), and headache (10.3%). ARIA-E and ARIA-H were largely radiographically mild-to-moderate. ARIA-E generally occurred within 3–6 months of treatment, was more common in ApoE e4 carriers (16.8%) and most common in ApoE ε4 homozygous participants (34.5%). Conclusions Lecanemab was generally well-tolerated, with the most common adverse events being infusion-related reactions, ARIA-H, ARIA-E. Clinicians, participants, and caregivers should understand the incidence, monitoring, and management of these events for optimal patient care. Trial registration ClinicalTrials.gov numbers: Clarity AD NCT03887455)",https://alzres.biomedcentral.com/counter/pdf/10.1186/s13195-024-01441-8,
50,"Vera Thiel, S. Renders, Jasper Panten, Nicolas Dross, K. Bauer, D. Azorin, Vanessa Henriques, V. Vogel, C. Klein, Aino-Maija Leppä, Isabel Barriuso Ortega, J. Schwickert, I. Ourailidis, Julian Mochayedi, Jan-Philipp Mallm, Carsten Müller-Tidow, Hannah Monyer, J. Neoptolemos, T. Hackert, O. Stegle, D. T. Odom, R. Offringa, A. Stenzinger, Frank Winkler, M. Sprick, A. Trumpp",Characterization of single neurons reprogrammed by pancreatic cancer,2025,Nature,,https://www.semanticscholar.org/paper/20f7ade1ee5b9d0bf71b29249fe64f13f03ddc98,,1615,2026-01-21 21:46:31,JournalArticle,10.1038/s41586-025-08735-3,0028-0836,,640.0,,1042.0,1051.0,50,50.0,5,26,1,"The peripheral nervous system (PNS) orchestrates organ function in health and disease. Most cancers, including pancreatic ductal adenocarcinoma (PDAC), are infiltrated by PNS neurons, and this contributes to the complex tumour microenvironment (TME)1,2. However, neuronal cell bodies reside in various PNS ganglia, far from the tumour mass. Thus, cancer-innervating or healthy-organ-innervating neurons are lacking in current tissue-sequencing datasets. To molecularly characterize pancreas- and PDAC-innervating neurons at single-cell resolution, we developed Trace-n-Seq. This method uses retrograde tracing of axons from tissues to their respective ganglia, followed by single-cell isolation and transcriptomic analysis. By characterizing more than 5,000 individual sympathetic and sensory neurons, with about 4,000 innervating PDAC or healthy pancreas, we reveal novel neuronal cell types and molecular networks that are distinct to the pancreas, pancreatitis, PDAC or melanoma metastasis. We integrate single-cell datasets of innervating neurons and the TME to establish a neuron–cancer–microenvironment interactome, delineate cancer-driven neuronal reprogramming and generate a pancreatic-cancer nerve signature. Pharmacological denervation induces a pro-inflammatory TME and increases the effectiveness of immune-checkpoint inhibitors. The taxane nab-paclitaxel causes intratumoral neuropathy, which attenuates PDAC growth and, in combination with sympathetic denervation, results in synergistic tumour regression. Our multi-dimensional data provide insights into the networks and functions of PDAC-innervating neurons, and support the inclusion of denervation in future therapies. A technique that combines retrograde axon tracing with single-cell transcriptomics is used to characterize neurons innervating pancreatic ductal adenocarcinoma and healthy pancreas, providing insight into the role of neural connections in cancer progression.",,
